{
  "schema_version": "3.0.0",
  "effect_id": "fixture-effect-id",
  "scope": {
    "tenant_id": "fixture-tenant",
    "project_id": "fixture-amplai"
  },
  "run_id": "fixture-run-id",
  "contract_ref": {
    "id": "fixture-ref",
    "revision": 1,
    "digest": "sha256:bc87b130fe6e2fb0156bdda50d7d14562db83b58199490694266def47b41773d"
  },
  "graph_ref": {
    "id": "fixture-ref",
    "revision": 1,
    "digest": "sha256:bc87b130fe6e2fb0156bdda50d7d14562db83b58199490694266def47b41773d"
  },
  "lease_id": "fixture-lease-id",
  "fencing_token": 1,
  "tool_ref": {
    "id": "fixture-ref",
    "revision": 1,
    "digest": "sha256:bc87b130fe6e2fb0156bdda50d7d14562db83b58199490694266def47b41773d"
  },
  "effect_class": "pure_read",
  "args_artifact": {
    "id": "fixture-artifact",
    "digest": "sha256:dcd22167f3ab965bf7a07fd2dd6a6dda553357bc1810049d35cd223026cb20a5",
    "media_type": "application/json",
    "size_bytes": 256
  },
  "effect_key": "fixture-effect-key",
  "grant_ref": {
    "id": "fixture-ref",
    "revision": 1,
    "digest": "sha256:bc87b130fe6e2fb0156bdda50d7d14562db83b58199490694266def47b41773d"
  },
  "requested_at": "2026-09-15T13:30:00Z"
}
